{
  "$schema": "http://json-schema.org/draft-07/schema#",
  "$id": "https://dylan-natter.github.io/ripp-protocol/schema/intent-candidates.schema.json",
  "title": "RIPP Intent Candidates Schema",
  "description": "Schema for AI-inferred candidate intent requiring human confirmation",
  "type": "object",
  "required": ["version", "created", "candidates"],
  "properties": {
    "version": {
      "type": "string",
      "const": "1.0",
      "description": "Intent candidates schema version"
    },
    "created": {
      "type": "string",
      "format": "date-time",
      "description": "ISO 8601 timestamp of generation"
    },
    "generatedBy": {
      "type": "object",
      "properties": {
        "provider": {
          "type": "string",
          "description": "AI provider used"
        },
        "model": {
          "type": "string",
          "description": "Model identifier"
        },
        "evidencePackHash": {
          "type": "string",
          "description": "Hash of evidence pack used"
        }
      }
    },
    "candidates": {
      "type": "array",
      "items": {
        "type": "object",
        "required": ["source", "confidence", "evidence", "requires_human_confirmation"],
        "properties": {
          "section": {
            "type": "string",
            "enum": [
              "purpose",
              "ux_flow",
              "data_contracts",
              "api_contracts",
              "permissions",
              "failure_modes",
              "audit_events",
              "nfrs",
              "acceptance_tests"
            ],
            "description": "RIPP section this candidate belongs to"
          },
          "source": {
            "type": "string",
            "const": "inferred",
            "description": "Must always be 'inferred' for candidates"
          },
          "confidence": {
            "type": "number",
            "minimum": 0,
            "maximum": 1,
            "description": "Confidence score (0.0 to 1.0)"
          },
          "evidence": {
            "type": "array",
            "items": {
              "type": "object",
              "required": ["file", "line"],
              "properties": {
                "file": {
                  "type": "string",
                  "description": "Source file path"
                },
                "line": {
                  "type": "integer",
                  "minimum": 1,
                  "description": "Line number (or start line)"
                },
                "endLine": {
                  "type": "integer",
                  "minimum": 1,
                  "description": "End line (for multi-line snippets)"
                },
                "snippet": {
                  "type": "string",
                  "description": "Relevant code snippet"
                }
              }
            },
            "minItems": 1,
            "description": "Evidence references supporting this inference"
          },
          "requires_human_confirmation": {
            "type": "boolean",
            "const": true,
            "description": "Must always be true for candidates"
          },
          "content": {
            "description": "The inferred content (structure depends on section)"
          }
        }
      }
    }
  }
}
