{
  "version": "1.0",
  "created": "2025-12-20T01:48:03.998Z",
  "generatedBy": {
    "provider": "copilot",
    "model": "copilot/gpt-4o",
    "evidencePackHash": "e8ec73ea7697fd0daa31c7c0a4a9dcb0087f53cec45291958d721a44d5a35d58"
  },
  "candidates": [
    {
      "source": "inferred",
      "confidence": 0.5,
      "purpose": {
        "problem": "Codebase requires consistent formatting and linting.",
        "solution": "Integrate ESLint and Prettier as development dependencies.",
        "value": "Improves code quality and maintainability."
      },
      "evidence": [
        {
          "file": "package.json",
          "line": 1
        }
      ],
      "requires_human_confirmation": true
    },
    {
      "source": "inferred",
      "confidence": 0,
      "ux_flow": "unknown",
      "evidence": [
        {
          "file": "package.json",
          "line": 1
        }
      ],
      "requires_human_confirmation": true
    },
    {
      "source": "inferred",
      "confidence": 0,
      "data_contracts": "unknown",
      "evidence": [
        {
          "file": "package.json",
          "line": 1
        }
      ],
      "requires_human_confirmation": true
    },
    {
      "source": "inferred",
      "confidence": 0,
      "api_contracts": "unknown",
      "evidence": [
        {
          "file": "package.json",
          "line": 1
        }
      ],
      "requires_human_confirmation": true
    },
    {
      "source": "inferred",
      "confidence": 0,
      "failure_modes": "unknown",
      "evidence": [
        {
          "file": "package.json",
          "line": 1
        }
      ],
      "requires_human_confirmation": true
    }
  ]
}